{
  "contractVersion": "1.0.0",
  "attemptId": "attempt-0001",
  "logicalJobId": "logical-job-0001",
  "manifestChecksum": "sha-256:dddddddddddddddddddddddddddddddddddddddddddddddddddddddddddddddd",
  "manifest": {
    "contractVersion": "1.0.0",
    "identity": {
      "recordingVersionId": "recording-version-0001",
      "timelineMappingDigest": "sha-256:aaaaaaaaaaaaaaaaaaaaaaaaaaaaaaaaaaaaaaaaaaaaaaaaaaaaaaaaaaaaaaaa",
      "segmentationPolicyDigest": "sha-256:bbbbbbbbbbbbbbbbbbbbbbbbbbbbbbbbbbbbbbbbbbbbbbbbbbbbbbbbbbbbbbbb",
      "segmentNumber": 1
    },
    "segmentationPolicy": {
      "version": 1,
      "durationSeconds": 10
    },
    "nominalWindow": {
      "startMs": 0,
      "endMs": 10000
    },
    "requestedSourceInterval": {
      "startMs": 3600000,
      "endMs": 3610000
    },
    "encodedInterval": {
      "startMs": 3599500,
      "endMs": 3610000
    },
    "timelineSpans": [
      {
        "mediaStartMs": 3600000,
        "mediaEndMs": 3610000,
        "matchStartMs": 0
      }
    ],
    "media": {
      "artifactReference": "segment.mp4",
      "mediaType": "video/mp4",
      "digest": "sha-256:cccccccccccccccccccccccccccccccccccccccccccccccccccccccccccccccc",
      "sizeBytes": 2048576
    },
    "producer": {
      "toolchain": "ffmpeg 7.1"
    },
    "createdAt": "2026-10-17T22:30:00Z"
  },
  "grants": [
    {
      "name": "segment-manifest.json",
      "url": "https://objects.example.invalid/segments/segment-manifest.json?signature=redacted",
      "expiresAt": "2026-10-17T23:30:00Z"
    },
    {
      "name": "segment.mp4",
      "url": "https://objects.example.invalid/segments/segment.mp4?signature=redacted",
      "expiresAt": "2026-10-17T23:30:00Z"
    }
  ]
}
